<?xml version="1.0" encoding="UTF-8"?>
<xs:schema xmlns:xs="http://www.w3.org/2001/XMLSchema">
    <xs:element name="temporada1">
        <xs:complexType>
            <xs:sequence>
                <xs:element name="jornada" maxOccurs="unbounded">
                    <xs:complexType>
                        <xs:sequence>
                            <xs:element name="partido" maxOccurs="unbounded">
                                <xs:complexType>
                                    <xs:sequence>
                                        <xs:element name="fecha" type="xs:string" />
                                        <xs:element name="hora" type="xs:string" />
                                        <xs:element name="equipos">
                                            <xs:complexType>
                                                <xs:sequence>
                                                    <xs:element name="local" type="xs:string" />
                                                    <xs:element name="visitante" type="xs:string" />
                                                </xs:sequence>
                                            </xs:complexType>
                                        </xs:element>
                                    </xs:sequence>
                                </xs:complexType>
                            </xs:element>
                        </xs:sequence>
                        <xs:attribute name="num" type="xs:integer" use="required" />
                    </xs:complexType>
                </xs:element>
            </xs:sequence>
        </xs:complexType>
    </xs:element>
</xs:schema>